Titles,Text
I might have the worst teacher in my grade this year.,"So, I have an ELA/SS teacher. I thought she'll be a nice lil old lady but boy I was WRONG. This happened during zoom, I was called into her zoom meeting (class). There were other kids there so I felt calm knowing that I wasn't in trouble. But that was false hope, it looked like I didn't finish a simple test. I didn't realize I had one, since I was absent due to visiting my cousins that day (They live about 5 hours away). She was mad at everyone, especially me. She wasn't upset, she was furious. But she covered it with a big fake smile. ""Why weren't you in class yesterday? Maybe if you were present you wouldn't be here honey."" I thought I already told the school about my absence, she should have known. But she is getting upset over a test that I could have finished right now, I knew she was going to throw a tantrum. I politely told her about my visit to my cousins, yet she was still furious. ""Why didn't you go during the weekend, you had a lot of time."" Yeah, why didn't I go during the weekend? Maybe its because it was Ethiopian New Year, maybe that's why. During those few minutes all she did was complain and complain, and the test wasn't even important. That's when I started to hate her.

Then it was during the Assembly (zoom). I had my camera off due to my wifi lagging (and also because i'm self-conscious about my looks). The teacher decided to private message me about it and saying it was disrespectful though literally 75% of the students (and teachers) had their camera off. So I ignored her and went back to focus on the announcements. After the Assembly meeting ended, my Dad got an email from her saying I had my camera off, she complained throughout the whole email. My friend, who also turned her camera off, did not get an email like that. Oh boy. Now since my friend didn't get an email I think that my teacher might be racist (since i'm black and my friend is white) but i'm not sure.

The fact that she gets angry at little things like if I forgot to turn in an assignment she gets mad, when I ask a question she replies by ""Find out yourself, sweetie."" or ""I cannot help you with that."" It makes me upset to know that I might be her least favorite student. I don't like it when people dislike me, it scares me and makes me feel like i'm not good enough. I want to be good enough. But I can't because this old little lady keeps on complaining and complaining. All those complains led to my parents hating me as well (they think I don't pay attention to class or not putting any effort in my work). Now, I don't wanna go to school (physically). I just want to stay home in bed and sleep. That's all. But I can't because the teacher would notice and call me parents. I feel pressured. And i'll put the fault on her. I might have the worst teacher in my grade this year."
My friend got choke by the teacher!!,When I was in 4th grade I went to school like any other day and I had to go to RSP it's for kids who don't do their work when I got back from that program I got told that my friend got choked by the teacher cuz he had his hoodie on the teacher use one hand to try to take it off but it got stuck on my friend's neck and the teacher use both hands to take it off and the zipper was cutting and choking him the next day the principal call everyone into his office and I told him the same story.
This teacher is just bad,Ok I’m still super mad about this. I got a new Spanish teacher this year and she is TERRIBLE. I have done all the work she has assigned and I have a 19.93 in that class. LIKE IM FREAKING TERRIFIED. I don’t know what to do. I am not the only one this is happening to. THERE IS NO PASSING GRADES IN BOTH LEVELS OF THE CLASS THAT SHE TEACHES. It is an online corse using a terrible program and our facilitior hates her too. I don’t want to get in trouble at home and don’t want to get a bad grade. But Listen what I found out today. She refused to accept this kids work that was BEFORE the due date. And the facilitator is going to take it to the STATE. And the superintendent of the county wants her fired too. I’ll update if anything happens. Edit I think my facilitator gave her a big yelling at because she finally put in most of my grades. I now have a b and honestly don’t care anymore. But some kids still don’t have theirs graded and still are failing.
I hated my teacher,"  

Fifth grade teacher didn't like me and he used to humiliate me in front of the class because I couldn’t figure out long division problems. He would keep me standing, red faced, at the blackboard for twenty minutes while he made snide remarks instead of explaining how to solve it. I hated him so much I prayed for him to die, … and he did. Had a stroke and I got a better teacher. I was ten and not sorry."
Crap tutor,"Was not a teacher but close enough that I think it counts.

In second and third grade me and some of my friends would go out and play football with some other kids. This tutor gets highered and she was like a permanent recesses tutor which never happens. Anyway she she’s us playing football and says “that’s too dangerous” we were playing touch and there was like seven of us. Not crowded or dangerous. So next day we play ultimate tag, “you could poke someone’s eye out trying to tag them” . Next recess me and my friends draw. “ you need to do something active”. We have a dance coming up in pe so we practice that. “You can’t practice dancing it’s too dangerous”, soccer, “ the goalies could get hit in the head”. “ basketball, “ the ball could fall down and hit someone on the head”. Groundies,” you could walk off the playground”. There was more but I can’t remember them. Point is she absolutely hated me and my friends. Never got into a single other person, just us."
Bad Teachers Episode 2: First and Second Grade,"So, I already talked about my bad first grade PE teacher. But what if I told you it got worse. Much, much worse...

My first and second grade teachers, Mrs. H, liked to yell. A lot. Why did she yell so much? I dunno. But my elementary school liked to hire people who yelled a lot. I can imagine an interview now...

A shadowed figure enters a room as the Star Wars sith theme plays in the background.

“So... you want to be a teacher at this school?” The figure asks the woman seated across from it.

“YES! I DO!”

“And what are your qualifications?” The figure asks.

“I LIKE TO YELL AND BE MEAN TO SMALL CHILDREN!”

“Okay, you’re hired.”

The unknown figure is foreshadowing for what is to come.

Anyways, Mrs. H was also very mean. Scratch that, she was just a bitch. She very much liked to tell small children that they were useless and wouldn’t achieve anything. What a great hobby. That sure didn’t make me cry myself to sleep as a FUCKING SECOND GRADER.

Jesus, I hated this woman. She also liked to do class read-alouds, where she would read a book to us and swear a lot. If someone so much as breathes loudly, they would be sent to sit on the cold, filthy hallway floor.

The good thing was, she was so loud you could hear her through the wall.

That’s all about her! Don’t worry about this series ending soon, Elementary School alone has about 3 more parts. Bye!"
“Exercise is good for you!”,"I just recently discovered this sub, and am going to share the stories of every bad teacher I have ever had. Since I’ve had enough to fill a novel, I’ll go in chronological order. First off: Mrs. S.

She was my PE teacher in first grade. PE is supposed to make you very strong and well-rounded in all forms of exercise. Not with her. All. We. Did. Was. Mile. Runs.

All my first grade class did, for the entire period, was run a mile. If we finished before the bell... we got to run another mile! Yay!

And she provided us lovely words of encouragement that rhymed with “move your asses!” and “hurry up!” Such a kind lady.

Also, once, during the second mile run of the class, I collapsed from exhaustion because I had just recovered from being sick and was still kind of weak. She literally just laughed at me.

If someone got cold or hot, and wanted to take off/put on a sweater, she yelled at us that we didn’t have all day and to stop wasting time.

Thankfully, over the summer, she went on sabbatical to India and never returned. We all hoped she was eaten by a tiger."
school dance,This was at my school dance in 7th grade. I was making a stack of cups about 36 cups high and I was trying to stop people from knocking it over then my annoying teacher came over and knocked it over. Then I had to rebuild it then she just came back and knocked it over again I really hated her
"Teacher yelled at me for going to the toilets for ""too long""","A couple of years ago, I was in Year 3 (around 7/8 years old) and this stupid teacher loved to yell at me. One time i asked to go to the toilets and she allowed me to but when i came back she yelled at me for taking too long even though i didn't take that long and won't tell me what to do for work and told me to figure it out myself.

Another time (think this was in Year 4) she explained the task to us and said we could work in pairs or by yourself. The girl next to me immediately asked if we could work together. I said ""no thanks i want to work by myself"" as this girl literally copies EVERYTHING i write and i find that quite annoying. She even copied my art and claimed that i stole her idea even though she begged me to tell her my plan. Anyway the girl told the teacher that i won't help her and the teacher proper yelled at me in front of the whole class. I don't remember the exact details but she shouted something like ""why won't you help her?! If you need help in the future she's not going to help you"" etc. I stood there dumbfounded. I never said i won't help her, i just said i don't want to work with her. Also i don't think i'll ever need her help in the future because she's proper dumb (not trying to be mean).

Good news: she was apparently fired sometime later that year as i never saw her again."
temporary principal is discriminatory against a worker,"hi i just found out about this story from a friend of mine that happened today or yesterday any ways onto the story: 

worker: w

Principal: Dick

In these times people are needed to disinfect buildings constantly and make sure people don’t get too close. W is one of those workers and he’s a very great guy, he’s smart and an all-around great guy to have as a friend, but he does have an issue with talking. You need to pay attention to him otherwise there’s a good chance you are going to miss what he is saying, it’s not a big problem, but apparently for some it is.

Since most of W’s job includes cleaning the cafeteria, disinfecting it, and making sure students don’t get too close while they don’t have their masks on, he’s gotten close to a few kids that don’t really have a lot of friends, well Dick took note of this and decided oh yeah that can’t happen because when the year is over W is going on a mission trip that’s going to be several months (I think).

Dick: hey W can we have a chat please?

W: sure, what’s up?

Dick (reading from a letter he wrote prior to calling W in): so I noticed that you’ve been getting closer to certain students.

W: yeah what about it?

Dick: well since you’re going on that mission trip I don’t think you should have or make friends here at XX, because they’ll be sad when you leave.

W: (very sadly) okay sir…

Dick had done something awful that affected my family and many other people pervious to this so if you'd like to hear it please say so."
Help,"I am currently a college senior that is aiming to finish all my general class and any history classes that I need to complete. So then I can do student teaching in the spring (COVID or not). For does who do not know how student teaching works. You can only take that class and nothing else (unless it's an independent study). Now here is the issue at hand I am currently an upper beginning Spanish class. I knew that it would be a challenge since I am taking four history classes and one bio class. But I have been juggling all classes quite fine that was until when I did the first Spanish test. It was bad like how is one suppose to complete a 67 question exam in 1 hour. Now you would think ""Was the exam mostly multiple choice?"" and I wished that was the case. Instead, we got 10 multiple choice and 57 short responses that were broken down like this-10 questions with listening portions to answers the questions. 10 questions that had you read a paragraph and answer the questions. 10 other questions were 10 were multiple fills in the blanks (like 6 in question) and 7 were a single fill in the blank. When I questioned the teacher that the exam was impossible to complete when we had class the other students also voice the same concern. It has gotten to the point where I sent out a grade appeal to everyone (felt like starting a revolt) as she is giving 0.7 out of 10 as a grade. If it was a 7of out of 10 my grade would not be a 68. I mean I have a 3.3 GPA and on the dean's list so I bust my ass when in class/home. I am not the type of student who slacks to the point my grades drop. I talked to the dean and even she agreed that it was insane and email the chair. (Oh did I mention that the exam was an online and open book for crying out loud. Who in their right mind times an open book exam when it's online WTF!!! and the icing on the cake was that the highest grade was 72 ( I found this on the grade scale on canvas) but this snake of Prof changed it four times (we have office 365 and since it's linked to canvas were are notified of every change) to where the highest grade was a 78. I feel like I am fighting a machine and I am only armed with screenshots of proof, other student backing me up and going to the dean, and now who know what will happen. But my question to my fellow Redditors is should I bug the deans until they listen. Or wait until I get my final grade and appeal it with all the proof?"
Sub teacher smacks student with a ruler,"Ok, this happened to my friend about a year ago. So she was not paying attention to class so the sub just went up to my friend and smacked her with a ruler. She told her parents the next day and reported it to the principal. The principle asked all the kids in the class what happened and all of them said that the sub smacked her with a ruler. She got fired the next day and probably went to jail for child abuse."
My teacher removed me from the meeting :|,"Not a cool story but I want to tell it  
so I commented something before class started (something funny to me and my friend)  
and the teacher saw the comment and removed me   


CLASS NEVER STARTED IT WAS JUST ME AND MY FRIEND AND SHE SAID I WAS DISTRACTING THE CLASS  
[http://chng.it/6qTKBK6P](http://chng.it/6qTKBK6P) sign the petition to remove the remove button"
Teacher who teaches students to teach gets taught a lesson,"I got a story that happened in my last year of high school in 2005 that featured a double standard teacher, a pretty jock that made all the girls drool, a confused vice principal and me, the nerd that everybody could take a shot at and get away with it.

Characters: Me (obviously) Jock (J) Mrs. Karen (MK) and Vice Principal (VP)

Story Start

In Senior Year I took a teaching class cause I considered being a teacher at one point, where you got to go teach in some of the nearby elementary and middle schools. The school schedule was an odd/even schedule meaning (for those of you who don't know) three classes each day with odd day attending 3rd, 5th and 7th classes and even day attending 2nd, 4th and 6th period classes. However before we could go out and teach in classes we had some reports we had to give in our class.

We all were given a week to write reports about topics of our choice about classrooms and I decided to be a bit bold and chose to do mine on special education (which is a sensitive and difficult topic that no other student thought of doing) and I made sure my report would knock it out of the park.

Each student went to the front of the class and gave their reports, and afterwards students listening were allowed to ask questions. I didn't raise my hand as much, until Jock gave his.

After Jock gave his report I raised my hand and asked a simple question only to be met with ""That is the most stupid question I ever heard!"" as the entire class laughed. I looked from him to the back of the teachers head in the front of the room who didn't respond as he continued, and without answering my question.

My turn to give my report and when I said it was about I saw the teachers eyes widen as I gave a great lecture, hitting all the high points like proper ways to address such things. When I finished there wasn't a single hand raised... except for one: The Jock

Jock: Why do we need to know any of these things? It's not like we're gonna be in a class with mentally retarded children like you.

I set my paper down on the podium and turn to the guy and said ""That was a stupid and rude comment."" before explaining why he would need to know those things before dropping my report into the basket with the rest and sitting down.

The next class we all got our reports back with mine with only a note in red ink saying ""Come see me after class."" I assumed that maybe I was gonna get some praise for tackling a difficult subject or something...

How wrong I was.

I approach the teachers desk after the bell rings while some of the students are still in the room.

MK: What you did in your report was very rude and unprofessional. i'm not sure this is the best class for you.

Me: What do you mean?

MK: The way you answered Jock's question was very rude and I don't think you're the right kind of person to be a teacher. I'm going to contact the office and request to have you removed from this class.

Me: And what about him? \*pointing to Jock standing by his desk\* You and everyone saw him to it to me first.

MK: I know, and i'm not going to punish him.

Me: So you're only going to punish me, that's bullshit.

MK: I will not be spoken to like that in my class. I will be contacting the office to have you removed and have you serve a detention. \*as she opened her desk\*

Me: We'll see about that. \*I turn and leave the room, walking past a classroom half full of students\*

I go up to the office and knock on my VP's open door to see him on his phone. He sees me and points to an open chair. He finishes he phone call and I guess who is on the other end as he talks

VP: You must be OP, I heard you made a disturbance in Mrs. Karen's class.

Me: It wasn't much of a disturbance, and I wasn't the only one. The other one did it and it was way worse. If i'm getting a detention he better get one too

VP: Another student yelled at the teacher?

Me: I didn't yell at the teacher.

VP: I'm confused. Who was yelling at who?

Me: Nobody was yelling

VP: Come back up to the office during lunch, I want to talk to you both.

I nod before reaching into my bag and pulling out my report and said ""You'll need this."" setting the report on the desk and walking out. Lunch comes and I go up to the office and in comes Mrs. Karen. VP guides us to his office and we sit down.

VP: Now Mrs. Karen could you explain what happened?

I sit and hear Mrs. Karen explain in great detail about how I gave my report and that afterwards I rudely snapped on Jock. Then today about how I was rude to her and that she put in a request during the previous break about removing me from the class and giving me a detention.

VP: \*turns to me\* is all that true?

Me: Yeah, but she missed out a couple things here and there.

VP: What things?

Me: Jock gave his report before me and said my question was stupid, only for everyone in class to laugh at me. I gave my report and he asked a question that was stupid and very disrespectful. And today she said I would be bad to this course even though I think I did a very good job on my report. On top of that she acknowledged in front of half the class that both me and Jock did the same thing to each other, but she only wants to punish me.

VP: Did he do a good job on his report?

MK: There's no doubt he did a good job on his report, it's his behavior that's the problem.

VP: Tell me about Jock, were you going to punish him as well?

MK: I don't think that'll be necessary.

VP: Go to lunch OP, and take your report back \*hands me back my report\* It was a very nice read.

I book it out of the room leaving Mrs. Karen and VP alone in the room

The next class Mrs. Karen announced that she will be going on maternity leave soon. I smirked as the teacher that replaced her was better. I decided to look my old school staff contact list and saw her name not on the list of teachers but in the list of ""other employees"" with the title ""Coordinator of Instructional Support""

Hope she learned something, cause I didn't learn a thing from her."
damned if i do damned if i dont,"so for context this teachers has always held a very noticeable grudge on me to the point where even when i do all my work on time and there's nothing missing he still gives me a shit grad. Now it does make seance why he dose not really like me because about a year ago i used to be a major dickhead in his class and not get anything done at all. But now i actually put in the effort and do all the work and be polite as possible and my grade is still the same as when i didn't do anything at all. Now for context for the image i was in school for most of the week and finished the entire weeks work 3 days before it was due... now after just doing nothing for 3 days cause well as i just said i did absolutely everything and there was no missing work i go back to virtual learning. Now for virtual learning for this class i will usual no do my work in the actual meeting i will do the work and get it done in time but i usually wait till after or do it before the meeting because i find it a huge distraction for me to have some one constantly talking about their personal life in the background of me trying to do work and getting a zero for dAiLy ParTiSiPaTiOn just because i muted the meet because it was to much of a distraction. Now Ive been doing this for a while and its never been a problem. Today however it is so i had a test and i will admit i should have done this in the google meet and its my fault for not doing it then when he wanted us to but i ended up doing it after the meet was over and letting him know it was done just to make sure he knows so it was done on time and no we didn't have to stream our screen or anything during the test so it had nothing to do with being able to cheat or anything the only difference is i did it after the meet. Now like i said before i emailed him to let him know it was done and the image is the response i got and he gave me a zero for the test and he obliterated my grade just because i did it after the meet how do you guys think i should respond to this? I feel like no mater what i say hes still going to find a way to shit on my grade and tell me all the reasons he thinks im a shit person.

https://preview.redd.it/xvyk1bn9l2s51.png?width=774&format=png&auto=webp&s=b94d4b7777679749f4af2892c9a5ee5d33ec9a02"
Teacher Quits Job To Become YouTuber,
Middle school math teacher who had no business working with kids,"I had this teacher in 7th grade for algebra. Throughout the school year she was notorious for playing favorites and outright bullying kids that obviously just needed extra guidance. 

One of these kids, Shaun, was a boy who at the time everybody viewed as a troublemaker. He didn't put in a lot of effort to the class, and hung around a friend group who was likely a bad influence for him. One day, Shaun accidently broke an electric pencil sharpener. All eyes fell on him when the loud crash was heard in the quiet classroom. Mrs. C went BALLISTIC, and began shouting at him. She ordered everybody in the class to bring $2 in so that it could be replaced. I understand that teachers often have to pay for supplies out of pocket, but the torment she continued to lay into this boy was so over the top. Even other kids started to ridicule him with her. One of the girls who sat by Shaun chimed in and told Mrs. C that he stayed up until 4am the night before. Mrs. C laughed and continued berating him about how he isn't going to go anywhere in life, and obviously his parents didn't care enough about him to raise him properly. He took this with his head hanging low the whole time. 

Then Mrs. C started to hand out worksheets. Math isn't my strongest subject, and at the time I had very low self-esteem. The boys who sat around me would often snatch my tests and worksheets to show to others how many problems I had gotten wrong. I always stood up and snatched them right back without saying anything, just looking at them sternly. While doing these worksheets I always used my hands to cover my answers so nobody could see them. When Mrs. C came around to see how everyone was doing she stopped at my desk. I'm not sure what came over me to be honest, but when she tried to take my hands off of my paper I fought it. She yelled out in frustration and threw her hands up, saying she was just DONE. She went to her desk and sulked while the class just sat in silence. 

So yeah, fuck you Mrs. C. Learn some self control before working with kids."
