Titles,Text
Hello everyone! I've implemented some new rules for this sub and rewritten its description. Please take a moment to make note of these changes as the new rules will be promptly implemented from this moment onward.,"This was a subreddit that I created with a friend back in high school some years ago and I decided to revisit it today in order to make some much-needed modifications. I'm hoping that these new implementations will establish the culture we had desired for this sub and encourage content submissions on the page that are befitting of our original intentions for this community. Though this is a subreddit dedicated to sharing experiences and instances of incompetent academic instruction, please take note that I am insistent on maintaining an atmosphere that refrains free of hate-speech, insults of racist undertones, use of slurs or blatantly derogatory terms, and any instances of witch-hunts. I've seen rather unsightly reports in my inbox over the last few days and I'd like to remind everyone that this type of content is not something that will be tolerated. In order to guarantee this, I will take action as needed in order to maintain a standard baseline of human respect in this community which includes post/comment removal and user banning if deemed necessary. We're all here to joke, poke fun, and be entertained. Let's do our best to keep it at that and not attempt to tear down the livelihood or reputation of others.

&#x200B;

With all of that being said, thank you for being a member of this page and I hope you all enjoy your time here!"
Teacher with questionable teaching?,"Hello I'm not really active on reddit and still pretty new. My grammar isn't the best lol so I'll try and clarify for any questions.

Anyway this story takes place not to long ago back when I was in grade 9 (currently going into 11) my language arts teacher seemed like a pretty good teacher. For the first few weeks of school getting to know everyone, telling us about herself, and even getting to know her hobbies. But after about a month in I started to realize that we weren't really learning a lot as our classes were just her life story or just reading a book and talking about it all class repeatedly. Towards the middle of the school year she got very political and putting her views on to us, I found this kinda messed up as at the time most of us were only 13 to 14 and not even close to being able to vote. If nobody supported her side in anything she'd never really pay attention to them even if they needed help onto anything. Before COVID-19 hit us she got karma (as most of my classmates put it) as she was preparing for her sewing class later that day and ended up chopping off a part of her pinky finger. She missed classes until the beginning of March and between the time of the incident and when she came back we learned absolutely nothing with writing only 1 essay that everyone failed because it just didn't make sense with what we learned. When we switched to online classes nothing changed it was just the same old things just on computers and when school ended apparently someone on the school council ripped into about her teaching methods. This is a little shorter version of everything but if you have questions feel free to ask"
Sucky Lunch Lady,"In Elementary school there were teachers that would walk around and would help kids that needed help and you would have to ask permission to go to the bathroom etc. I already had a bad history with this teacher and she made no sense at all. I asked to go to the bathroom and she said I had to finish my food first, sent me to naughty table for asking my friend for chips and so on. In this story we had just gotten done with lunch and we were in a line to go back to class and before we were about to leave one of the obnoxious loud kids started yelling out loud in our line and the lunch teacher heard this and came by and asked ""who was yelling?"" everyone and I mean EVERYONE pointed at him including myself and she said ok and as our line was moving out of the lunch building she pulled me aside and said ""why were you yelling"" and I said ""It wasn't me"" and she said ""don't lie to me"" and I said ""Ma'am it was the other kid and everybody pointed at him its not me"" and she said ""yeah whatever"" and sent me on my way. honestly hated her and glad I don't have to deal with her BS anymore."
My teacher who tried to accuse me of sexual harrassment,"Now before I tell the story I want to say this I guess I was kinda in the wrong but she did was nothing short of evil



So this started at fifth grade I was twelve and my friend Michael told me a joke it was how I 1 2 half 6 with 2 sounded like so I wrote it down then threw it away and one kid I'll call her Jessica so she picked it up and gave it to kylie (my crush) and everyone knew this and she obviously told the teacher and she said one more thing and I would get detention even though she didn't even lt me explain and at the cafeteria kylie told everyone about it so a bully I'll just call him josh was flipping a mini milk carton and saying stuff like: if this lands kylie and ""hydra"" will get married and other dumd and explicit stuff and every time he did he would tell kylie I did it and she told the guidance teacher and stuff and our teacher who got no wind of this just sends me to detention again not letting me explain and tells my parents that it said I want to have s** with you even though it was numbers but we got it resolved because of eye witnesses and I also want to say thanks Ethan who was one of the witnesses and my friend back then but she didn't get fired but still got in trouble for not seeking evidence 


I again was in the wrong for writing it down in the first place so yeah but next time check the evidence she also hated me for unknown reasons and I'm kinda glad for covid cuz I don't have to see her face anymore"
Nursing year 1 semester 1,"As the title says, the following took place during my academics in obtaining my nursing license...graduated in 2008.

First month in my anatomy class. The professor was a well established nurse at the college that I was attending and in the nursing community overall. First topic we covered was the skeletal system. 

The day before the test on said subject, the professor decides to have an open book review. After going through the whole basic bone structure, she asked if anyone had any questions before we went into further detail. 

I raised my hand and asked if she was sure that the scientific name for the bones at the wrist was metatarsal and those at the ankle was metacarpal.

She chuckled in a sarcastically amused manner and assured me that she was correct in saying that.

To which I asked why when athletes, like tennis players, get chronic wrist pains it's referred to as ""metacarpal syndrome"".

A few minutes of blank stare and eyeball shaking, she looks at the class and says...""So yeah, these are your carpals,"" pointing to her wrist, ""and these are your tarsals,"" just points to the ground. 

At that point, I saw several of my classmates frantically scratch out words in their books and rewrite other words."
Knowing what a quiz is.,"With collage being online, the teachers seem to have different teaching methods in place. That's ok but my teacher makes TIMED QUIZZES. My teacher gives us material to study logical fallacies. In the quiz, he timed us to find REAL LIFE examples of them. I struggled to find the 2 that was needed and only found 1. So I only got half of my quiz result due to the fact I wasn't good at treasure hunting for a example. The quiz did not test my knowledge of what I learned, in turn, it tested how well I can surf the internet. Thanks to that now I have a lower grade."
Imagine getting a bad grade because of expressing your opinion,"(This is part 2 of my story)
So fast forward 6 months from the previous incident.This time it was citizenship and civic education (the subject where you have to learn how to be a good citizen, government forms, constitution,etc.) teacher.So usually they have to be politically neutral (at least in my country (im not from us) don't know about other countries tho),but this particular individual is different.She has this strong political believe that come off like a propaganda when she teach,she always blame the cirrent gov for everything because they came from different political beliefs.So now on to my story, it's the final exam and on the paper she asks opinion about a very sensitive current political issues and i fill in my opinion.And because my opinion was different from hers she gave me a D for final exam ignoring other questions i got right.This lower my average score on my report card shattering my hope to get a scholarship into my dream uni.So yeah i have to study real hard to pass the selection test for my dream uni wish me luck guys!"
A music teacher,"Hi. It’s my first time here, but I had a terrible teacher once. He was a music teacher that was decent at teaching general 7th grade music, but whenever we had free time, he would tell his opinions to everyone in the class. I have no idea why. He acted like a internet troll, but in real life, and you were stuck with him for 45 minutes a day. One day he went on and on about one kid on his daughters volleyball team, that, in his words “is to fat to be a setter”. Another was how the weekend sports kids are snowflakes. And on and on. It got more political too, about how masks are ineffective and the government is hiding stuff from us. We recently moved, and I am so very glad to be away from his class. Anyway, if you got this far, thanks. 
- R. Furbies"
Geometry & PTSD,"My freshman year of high school, our geometry teacher was a Vietnam vet, who like too many others that went there, had a terrible experience, and returned with a severe case of PTSD.

He was actually a rather good geometry teacher, and clearly knew his subject. The problem was, certain noises, smells, or words would cause him to have flashbacks, and he would get a panic attack so severe, he'd think he was back in the war again. In one instance, out of the blue, he went from writing something on the blackboard to suddenly yelling ""Get down!!!"". He grabbed my friend's head, slammed it into their desk so hard, it left a baseball-sized bruise on their cheek, and wrenched the poor kids neck on top of that. My friend was out for almost a month because of that incident, but the teacher didn't get fired because the school was fully aware of his PTSD and knew that something like this might happen.

Needless to say, not one kid in his class acted out, was disrespectful, or ever did anything bad to him, so I guess that was one silver lining."
Spanish Chemistry,"My sophmore year of high school, the school hired a new Chemistry teacher. The only problem was, when they hired her, she didn't know a single word of English, as she was born & raised in Spain and never botherd to learn English until the day she started teaching here in the US. Don't ask me how this happened, not one of us in her class that year could figure out why, and it wasn't from a lack of effort. So throughout the year, most of the students that actually grew up speaking Spanish would take turns getting up to the front of the class and translate for her as she would often begin each sentence in very broken English, then finish it in Spanish. This was pretty much a daily occurrence. We all agreed that it was good she wasn't teaching AP Chemsitry, since we all very much doubted anyone, even the Hispanic students, would pass, given the way she taught.

In fairness, she probably would've made a great Spanish teacher (even though we already had a great Spanish teacher at the school who was born & raised in Peru but unlike her, spoke perfect English) but between her inability to speak a coherent sentence in English, and the fact she had some.... interesting.... hygiene habits that most of the students mocked her for behind her back, she only lasted one year at our school."
Making me hate the work,"For context, I’m in an animation corse, learning 2D animation. Before this I (and most of the class) had never touched animation before. 

I love animation and I genuinely think this is what I want to do for a career. 

This teacher started the first class saying that this will make some of us cry. Bluntly saying that Atleast half of us will drop out. Great first impression. 

We started a ball animation and I thought that went well. (My file was corrupted and I had to start again but oh well) then we did a flour sack. 

We submitted this and everyone thought we did ok, considering for some people this was thier first animations. 

This class we got SLAMED, he started with “great news guys, I now expect much less of you” because apparently we are all lazy and will never get a job because we didn’t put in 40 hours into this project. (We have 3 other classes a week that also need attention) 

He went on to tell us how so many of us almost failed because one minor thing was off. 

Teachers should not hope for their students to drop out."
I have 3 bad teachers in a single school (I will tell the last one tommorow),"Last year around the first wave of Covid (around June-end of October).My parents who both works in medical fields get tested positive for Covid and just in 3 days i get tested and the result was also positive(Note that i always followed the Covid protocols and barely even go outside so it's definitely come from my parents).I some symptoms ranging from fever,lost sense of smell,diarrhea.So automatically i am unable to attend online school for around a 3-4 weeks.Long story short,I finally able to attend online school and this one teacher told me that i have to finish 4 weeks worth of math assignment that i know nothing about and gave me 2 days to finish it because she said that they need the marks to fill the mid-semester report card.Thank god one of my friend was kind enough to send his work for me to copy.The next day,this time the PE teacher told that all boys must come to school(and yes Quarantine is still mandatory in my place at that time) to take a Physical Endurance test for the same reason as the Math teacher,to fill the report card.So I ask him to not do an Endurance test and ask for a paper test.He refused and said that I have to come and must do the test.Hence i done it almost Fainted  and failed rhe test.I literally felt so weak after that and can't attend online school for an additional week."
Teacher suggest that my sister to be kept a distance away from her friends due to her tics.,"So this happened very recently (yesterday), for a little bit of context one of my sister’s tics went off. This tic made her grab arms grab her two friends sitting on each side of her (so like left arm grabs person on the left, right arm grabs person on the right). Her tic wouldn’t allow her to let go of her friends’ arms also this happened at the end of class so none of them could go to their classes (they were all in different lessons for the next lesson). The teacher told the three of them to stay while she called two teachers. The two teachers came to the classroom they were in and my sister explained why she couldn’t let go. Also to keep in mind these teachers know about my sister’s tics, so what do they tell me sister to do? “Well they need to get to their classes, so you really need to let them go”. My sister can’t let them go, because her tic won’t let her! Anyway my sister did say to them, “Well how can I let them go if my tics won’t let me, you know I can’t let them go, because my tics won’t let me” the two teachers said nothing and walked out. My sister’s teacher stayed in the classroom of course and in the end my sister’s tic did stop and they got to class.                 

Fast forward a little while later.

My mum gets a call by one of the teachers that went into the classroom. Well what did this teacher suggest they could do my sister? Well she suggested that keeping my sister away from everyone in her classes like in the same classroom, but just away from other students, oh and to make sure my sister’s friends and other students to keep a distance away from her during break and lunch! Like what the heck this isn’t gonna nice for my sister at all, they’re basically saying “Stay away from [sister’s name] at all times”, my sister got really upset about this, because she can’t control her tics and she said she’s gonna feel like she’s being isolated and treated differently. The teacher suggested this because “We care about the welfare of our students”. Well if they cared so much about students’ welfare then why did they ignore the fact my sister or her friends were getting bullied by other kids? Oh that’s right, because they didn’t want to deal with it only one teacher sorted it out and it wasn’t that teacher. That teacher (who called) knows that my sister’s mental health can easily go bad if students were told to keep away from her, which would make my sister feel like a burden due to her tics."
The teacher that most of the school HATED.,"I used to attend a private middle school, and our art/music teacher was one of the most strict, and most hated teachers I've ever met. We'll call her Ms.A). Ms.A would make us line up in front of the door, and if we learned something from the last week, we would have had to memorize it with no warning, IN ORDER TO BE ABLE TO ENTER THE CLASSROOM. Considering we would need to take notes, and since this was an art class, we would need to use the materials that we bought with OUR MONEY, right? Well, Ms.A had a rule that made it so that whenever you dropped something, IT WAS NOW MS.A's PROPERTY! I graduated a few years ago, but if I remember, a girl lost her glasses to the hands of Ms. A. 

By the way, my class has one guy who would always talk, and he was what you could call ""the weird kid"". He was the sole reason most benefits ere taken away from my class in particular. Ms. A was so strict, she wouldn't allow us to even whisper to each other while we're in line/in class. If he heard someone talking, SHE WOULD MAKE US WALK DOWN AND UP 3 STORIES OF STAIRS (art/music floor is on third floor). The worst part? We had to carry our backpacks with us the entire time, since it was our last class. Since it was on a Thursday, WHICH MEANT MOST OF OUR TESTING WOULD BE TOMORROW, MOST OF US HAD PLANNED TO BRING OUR TEXTBOOKS HOME! The back pain was un-bearable. Probably my worst teacher, I couldn't imagine having her as homeroom."
Asking for opinion: were they bad teachers ?,"This is the first time I have even dared to think of them as being ""bad"" because everyone in the school seems to love them. But I think it may be a good time to ask for some real opinions. 

Teacher A is well loved by students, but I think he is a bad teacher because he makes really sexually explicit jokes and somehow those jokes got passed off by all students as being harmless. He likes to detain students after-class to help them with ""homework"" and they happen to be almost all girls. Also likes to talk about his female student's physical attributes. I find him gross and decided I wouldn't talk to him. We had a fallout and the school intervened. I never told the school what had happened, but then he continued to teach there until present day, is he a bad teacher? 

Teacher B is from Cambridge and is a single mother. Don't get me wrong, she is wonderful and such. But when I ask her whether she thinks I should apply to the school (cambridge) with my grades, she told me that I wouldn't stand a chance and should not even try. Now I came from a prestigious private high school in North America and my GPA is 93%, and with my grade in history being 100% throughout all three years. I have also had 2AP history courses and ended up getting a perfect grade on them as well. Also scored 800 on 2 SAT history subject tests. I don't understand why she is being so critical/sour about me. I can feel like she doesn't like me, but why would she lie about me not having a chance at applying to cambridge ? I ended up not applying to the school and regret about it since I took her opinion seriously."
My teacher was a bitch,"When I was in high school I was put into the ""special"" class due to the fact I have mild Asperger's (my emotions are muted and often fleeting). Teaching this ""class"" was a woman I will refer to as Mrs. E. Mrs. E had taught the class for years and was apparently used to dealing with students whose conditions were NOT mild, so when I got to class she seemed to take offense to the fact that I was fully cognitive. She would treat me like everything I said was nonsense, reasonable requests that most other teachers would allow she would utterly dismiss and she would never take criticism, bad or constructive. This seemed to come to a head when she assigned a stupidly simple worksheet to the class, I finished it in a couple minutes and turned it in. Soon after she decided I did it to fast and gave me another of the SAME worksheet, as if that would solve anything. I was annoyed, but I did that worksheet just as fast as the first, I turned it in and she couldn't seem to accept that I wasn't mentally challenged and gave me the same worksheet again. At this point I was greatly annoyed and refused to do the third copy of the worksheet, to which she proceeded to yell and verbally berate me for not doing the assigned work, I ignored her and simply read the book I had with me. While I was reading she attempted to snatch the book away from me, which she failed and demanded that I give her my book, which I refused. She continued to scream and yell, going so far as to bring like minded teachers in to yell at me as well, all while I sat there silently ignoring them. This kept going for nearly half an hour before my parents were called. They, unlike most parents, agreed with me over the hysterical teacher. After all that I was not punished in any way and was even praised by my parents. Really the only downside was that I was pretty much on Mrs. E's shit list for the rest of school, and she was my second worst teacher!"
My teacher who shames my looks,"I do still have this teacher but thankfully not for long as I'm changing schools soon.

So whenever it's a school photos day or something that has to do with taking pictures of me I always fear for the worst and it really doesn't help as I have major anxiety. For example, my teacher shames my smile, weight and even my eye shape. She shames me on how skinny I am, and tells me to gain more weight as I'd look like a skeleton soon. So she always tells the people who make the lunches in the school kitchen to give me extra food as telling them that I haven't had my breakfast and that I'm ""hungry"". Which is annoying because you're always forced to eat almost all your food before you can go out to break and I always end up either struggling to eat it all or almost throwing up in the bathrooms after eating it all.
There's also the shaming of my smile and teeth. Now my teeth aren't perfect as I have sticky out bunny teeth and my smile is crooked as I can never smile on command properly. And my teacher makes me never want to smile or show my teeth. She tells me to smile, I smile for the camera and she either tells me to not do my ugly smile or to not smile at all because my smile is fricked (she uses the word frick instead of fuck or she'd get in trouble for swearing at the students). My eyes are also quite small and kinda slanted as I have some asian heritage but my teacher doesn't care. She tells me my eyes looks like I've been beaten and that their so slanted it looks like they're about to fall off. 
And it's not only me who has this happen, it's basically the whole class. As she does racist actions to the different toned skin people in my class and fat shames other people who aren't even overweight in any kind."
"i got in trouble, for STICKS BEING FROWN AT ME","ello, i have posted on this subreddit multiple times

starting of i will say i have adhd and asd so my wording might be bad and sorry for not posting for a while , i wasn't happy

cast:

bdms: bully during middle school

hg: his girlfreind 

btbtak: being taught bad things  and kid

bt1: bad teacher 1

bt2: bad teacher 2

me: me

so starting off i am sitting down probably stimming when the bullies came along

bdms: :starts throwing sticks: look btbtak he ain't doing anything

btbak: ok :starts throwing sticks:

me: :zones back in: stop throwing sticks at me

bdms: what are you going to do about it

btbak: yeah its 1v3

me: its going to be a 1v2 , sorry i dont feel right putting more holes in you little girl

hg: you b\*tch

me: you talking about yourself?

bdms: you're going to be the one with holes in th-

before he finishes saying the word there all throwing sticks at me

i am now threatening i knock them out bc i have anger issues \[ a part of adhd\]

this kid is now crying so teachers are coming out , not that way, to us to see what's happening   

ow there saying i tried to stic this stick down there arse

bt1: op why did you do these things

me: i did-

bt2: dont lie , you know what i dont want to hear it, we will figure out a punishment

me: THERE'S CAMRES CHECK THEM

i get in trouble and guess what

its extra home work , what the f\*ck

i have a bunch more storries so let me know if you want more :\]

[View Poll](https://www.reddit.com/poll/obykqa)"
