Titles,Text
English Teacher Hated Me,"So I am from Europe and English is my second language. I started learning English on my own as a kid when listening to music and watching shows, and English is honestly not a difficult language compared to some others (+ you learn like the same six things every year in school).

In high school I had a different teacher every year, and they all had their own teaching methods. Not to sound like an ass, but I did know more than my classmates, and by 9th grade I was already fluent in English.

My 9th grade teacher understood I was bored in class, so he made me read more advanced books and write book reports instead of the homework assignments everyone else had. My 10th grade teacher let me study other subjects during class, but did require me to present the same homework as my classmates. I thought both teachers were very fair.

In 11th grade I got a really nice teacher that didn't require me to do homework or study, and she even provided me with a Cambridge textbook so I could prepare myself during the year to take the Proficiency Exam.

However, I got a different teacher in the 12th grade, the most important year where every single grade counts before university.

This woman hated me from the first day and I'm not exaggerating. She was the head of the English department, and I guess the other teachers I had over the years saw that I would be in her class and mentioned that I was a bit more advanced than the rest of the kids.

So on the first day of class I'm completely prepared to pay attention (I don't know this woman and I don't know if she will let me do what I want like the other teachers or not). I have a notebook out and I'm taking notes during class. She doesn't look at me once. She asks us to present ourselves one by one in English (typical stuff - name, age, a hobby). I get up, say my name and how old I am and she cuts me off and tells me to sit down. Everyone kinda just stares at her or at me and there's an awkward silence. I sit down and try to not turn red.

She comes up to me the next class and says ''You must be really bored in class, huh?'' and is being super sarcastic. I tell her that is not the case at all, and I have been paying attention. She ignores me and walks away.

During the rest of the year she purposefully gave me and another boy in the class lower grades. The difference between me and him was that she hated me from the first day, but started hating him after she found out he was also good in English. We were the two best people in class and got grades that were sometimes lower than the people that didn't know the basics. As she was head of the department, we couldn't really complain and had to keep our heads down.

I handed her my homework during the first few weeks of school, and she corrected a bunch of things that were not wrong at all. I asked her what the issues were, and she once again sarcastically replied ''I thought you knew English''. I refused to do homework after that, so she stuck to correcting my exams wrongly.

She also specifically corrected my friend who sat next to me whenever she felt I was giving him answers. He asked me simple things during class and she would tell him that they are wrong on purpose. For example, he asked me about numbers once. He wanted to know if saying twenty three hundred instead of two thousand and three hundred (2300) is correct. I told him yes. He then answered the teacher by saying a number that way, she looked at me, then said ''Who in the world told you that this exists?? This is so wrong!'' and then LAUGHED AT HIM in front of the entire class.

At the end of the year, we get our grades and I of course have a terrible grade (7/10). As she's handing me the papers, she has the nerve to say ''Such a shame you didn't cooperate during class.  I would have bumped your grade a bit if you had done your homework''.

I contemplated whether or not to go back to the school and hit her over the head with my C2 certificate but why would I even bother?

TLDR: English teacher hated all students that knew more English than her (she was terrible at her job and couldn't even speak properly)."
Music teacher forbids violas,"Freshman year I was second chair viola in the school orchestra. Sophomore year, the music teacher retires and a new music teacher posts the audition sign ups. I noticed there were no viola slots and went to him to ask about it. 
Me: Mr. H (obviously not real initial), where are the viola sign ups?
Mr.H: We aren’t doing violas this year.
Me (thinks this is a weird viola joke): Um, but who’s gonna fill the viola parts?
Mr. H: We’ll have a third violin section. Violas are too problematic.
I thought he was just joking and just awkwardly left. But no, he wasn’t joking. He didn’t allow a single viola into his class that year. He’s either a moron or someone that’ll do anything for a joke."
Math teacher keeps counting off random points,I’m in 11’th grade and my teacher keep counting stuff wrong or partially wrong even though they’re completely right and I show all the work and recently she gave me a 20/50 on a math xl assignment (online math) even though it clearly shows that I got 50/50 questions right and she got onto me for a really small issue I caused I’m working on emailing her to get credit for those questions. Thoughts?
Teacher threatens kid with expulsion for probably nothing.,"So in 5th grade there was a teacher, Mrs. C.    
  There were rumors spreading that she was calling my class a bunch of female dogs (worse language was supposedly used).  I didn't believe these rumors until one day...
      A classmate bought chips with his lunch.  A lunch lady came up to our table and told him that the chips weren't charged on his account; accusing him of theft.  So he says
that it was a mistake, appologises, and gives her his account info so he can pay.  For a few minutes we think that's the end of it. Then we see a fuming Mrs. C come over. She asks him ""What happened?""  As my classmate begins his response, Mrs. C shouts ""U STOLE IT!!!""  Every attempt to calmly speak is met with ""U STOLE IT!!!"" or expulsion threats.  Keep in mind, this is a $1.00 bag of off brand Lays, which were eventually payed for.  But it gets worse; after lunch,all we can talk about is the crazy lady's verbal rampage, so naturally she randomly bursts into our classroom,disrupting class, and threatens every one who committed the 'heinous crime' of speaking words about her with loss of recess, a tactic similar to dictators who would heavily censor newspapers or lock up those who disagreed."
PATCHOULI IS HELL,"When i was in a special needs class in middle school the substitute teacher would slather on patchouli lotion. we would turn into a pack of wolverines because the smell was unbearable! the teacher was nice but the smell would make every slight action unbearable. one day we saw her run empty on her lotion, we were going to celebrate only to find out she had 10 more bottles in her purse!!!!

When you're a special needs teacher you don't put on obnoxious colors or strong perfume because these are absolute pain for people with sensory issues!"
Teacher forbids me to eat,"Ok to get this out inglish is not my first langua 

Head acters: me: just some kid t: hellspawn teacher mf: my friend  


So we had a 3d printer at school and we made our own design to print it out it was almost reces and i was working on a design and i didnt know how to save it so i went out and ask my teacher not the other one this is the good one and i came back to save it and mf wanted to show his design so i looked at it ar the time everyone was out side at this point so t says go outside to late to outside and i think to myself this is the only reces for today i want to eat so i ignore her and grab my bag and go outside she kept saying to put it back and finnely the twig holding anger snapped she rushed at me and before i could step outside i was pulled back inside  dragged back and as the kid i was i started crying and then she was rambeling about a ten year old boy crying impossible then a few hours later i told i was hungry and said i didnt eat and my mom was like why i told the story and i heard that she put a kid in a closet as punishment and that was my story about a hell spawn teacher"
My younger sister’s homework...,
r/PRATTAlliance - The people’s republic against terrible teachers.,Post memes and stories at r/PRATTAlliance
Teacher explodes twice (2 separate days,"Ima make this short for convenience
Grade: 7
Teacher: substitute
Story 1
Why she exploded: some kids being annoying plus mine and my friends tone
So me and my class were going into social studies which is in our class with a NEW AND DOWNGRADED TEACHER!
So me and my friends are sitting there talking and writing than I handed in my work and said here in my normal voice 
(In school it sounds like I don’t give 2 craps bout anything) 
And some people were just talking and not doing work also being annoying like usual, every teacher knew we had a tendency to do so
And she seemed very annoyed witch was unusual to say the least most teachers laugh our just tell us to be quiet or make jokes with us them but not this ant fun asshole she started yelling and saying that 
“I can’t believe your going  to grade 8”  and “I’m very disappointed” 
Before she could rant more the bell rang THANK CHRIST
Day after rant 1: after assembly witch we have daily (they’re sooo annoying) 
The principal and the Substitute came in and said we all had to write letters. Even me and my friends did for whatever reason so I wrote one saying I’m sorry for whatever reason i was I didn’t know, when I handed it to her she said
“It was for ,y tone and it was impolite ” first off if she ever heard me talking and if she did my voice sounds as if I’m always sarcastic and second off I find it kinda insulting that she would make me write a letter over my own voice
Now I have to ask my friends what else she said I’ll be back soon."
Sopmore Spanish teacher has favorites and attempts to embarrass/bully kids she doesn't like,"I had this Spanish teacher who over all was just a constant bully to the kids she didn't like for whatever reason. She singled out me and a couple other girls. I was always incredibly quiet and shy in the class, at the beginning of the year she had an attitude with me and set up situations to make me look stupid and say these little comments. At first I dismissed it but then I tried to tell my councilor of her actions many many times but he always happened to not be there :/ So then I'd forget and the cycle would continue. Eventually when I never gave her the reaction she wanted she started picking on these other two girls. While creating a pedestal and favor two other girls who she saw as smart and successful. While constantly putting the others down and making people intimidated to try. Especially people like me who are constantly processing alot of stuff already so they react slower then others do. I remember on the last day of how she randomly decided to just rip into me because I mentioned how I was trying to find a job because she asked me what I was doing over the summer, while the other girl she liked already had one. She made a comment along the lines that I was already too late and I wasn't going to get one at all, acting like I was just some waste case because at the time i dressed badly due to the financial issues my father and I dealt with. 

She was much better at insulting you without directly saying it flat out then she was ever at teaching Spanish. It was ridiculous because my Brazilian friend called her out on so many words she didn't know (she wasn't native to the language) and her accent was terrible. 
So dear mrs. A, enjoy your sad pitiful life of bullying teens you deem are worthless/stupid.
I know my worth, people like you will never make me believe I'm stupid because I don't fit your mold. I'm training to become an EMT, and I'm not just some junkie kid so screw you. 

Tldr; My petty spanish teacher picks favorites and puts down basically the rest of her class while choosing a couple of kids to harass throughout the year."
Choir director thinks I shouldn't report students who bring drugs to school,"So this is actually my first Reddit post, but I got hooked on Reddit readings on youtube, and I created an account just to tell this story. Feel free to correct me on things Reddity.

But some backstory: My school at this time had a ""tip line system"" which was just an area on the school site where you could leave reports of something you thought the principal needed to know. I think it was supposed to be anonymous unless the principal needed to talk to the poster. The school could track whatever you did on the Chromebooks they give out to students if they felt the need to.

I'm a big choir nut and I refuse to go to a school without the art. That year the choir teacher I had was definitely...weird. She was beloved by her students as choir directors generally are. She was just kind of an odd ball-even for a choir teacher. She was terrible at planning and really just bad at teaching. I didn't agree with her methods and she taught my class next to nothing. She just let all the girls interrupt her to have a class-wide gossip session. I spent most of my time next to some insufferable people who only wanted to talk and sneak time on their iPhones. They even disliked me and my friend for ""not trying' when in reality we were just not so good at the jacked-up way we had to sight-read due to being new kids to the district.

Anyway, this school was a lame Junior High so a lot of classes had ""A+ tutors"" who were just older high school students who got volunteer hours in by helping around some classes. We had 3, 2 girls and 1 boy. I don't have to censor names because I never bothered to learn them. The girls hung out with each other most of the class, and would often bring the Choir teacher (let's call her Mrs. C) Sonic from across the street. The third one, who's name I should know by now, literally listened to music 90% of the time on his phone or sometimes gossiped with the annoying girls in my section while they should have been practicing. 

One time he was doing just that. After chatting to the other tutors, joking about his cup which was NOT a see through bottle.  They were whispering back and forth, but the Alto section of the risers was close to where they sat. 

Girls: Wait. what is it?

Boy: \*whisper I couldn't catch\*

Girls: wait really? What flavor?

Boy: Green apple!

Girls: oooh. Yeah, I like wine better. I've tried it once at my mom's but I-\*notices the teacher and quiets down\*

Boy: Wine is shit. Do you want to try some?

I'm pretty sure they declined. This is definitely not the exact dialogue, its been quite a bit. Later this caught the attention of the annoying girls. The loud one interjected into their conversation. She asked what it is and he mouthed something I couldn't hear, but I was sure it was ""beer.""

They had a similar conversation I couldn't quite hear despite desperately trying. After the class got out It was time to go home. When I got home I was nervous. I knew I needed to report it, but I  wasn't sure how. Even though it was the beginning of the second semester, I didn't even need to talk to the principal or really even go to the secretaries. Then I remembered the ""tip line"". I heard kids joking about it, but I didn't really know what it was. I had, however, seen it on the school site.

I opened up my Chromebook and described what I thought happened. After that, I shut it back down and forgot about it. 

A few days later I got called to the office during gym. I was drenched in sweat and wearing old, oversized clothes. I also immediately shivered as I entered the air-conditioned office lol. As a certified good kid, I was extremely nervous when I talked to the principal. He showed me a picture and asked me if I recognized the kid. At first, I said no, but then I took a look again and realized it WAS him, he just changed his hair. It really sounded like I was lying. If I wasn't me, I would've *thought* I was lying.

Here's where the teacher comes in. (I know it's been a long post already lol)

No one noticed for a few weeks as the tutors seem to pick and choose when they actually show up to school. (I remember this part much more clearly)

Loud girl: When is ( Boy Tutor's Name) coming back?

Mrs.C: \*visibly annoyed, instantly\* Never

Loud girl, dramatically: What?! Why?! (while the other ones gasp)

Mrs.C, full of disgust and rage: someone *TIP LINED* him. 

The entire class goes quiet until another girl asks why.

Mrs.C: I Can't actually tell you that I'll get in trouble. But I *can* tell you it was someone in this room. I don't think they should've done it-he didn't deserve to get in trouble and lose his scholarship for something so stupid but-whatever It's not my place to discuss. What's done has been done.

The worse part is that this is the type of teacher to have obvious favorites and she showed her dislike for me from this day on.

Also, I ran into the tutor boy a few times when I went up to the high school to get algebra help lol. At one point he was complaining about going to the local college because he 'didn't have the scholarship with A+ anymore' or how he got his truck taken away 3 times since then for ""pissing off"" his parents.

Even though my own guardians at that time (not my real parents) also chastised me, I think I did the right thing. ~~Actually I know I did.~~"
"Found this subreddit and love it, will be happy to become a moderator.","If you have any bad teachers memes you can post them here in r/PRATTAlliance if you want, similar to bad teachers but mainly memes and personal stories."
7th Grade English Teacher From Hell,"I’ve tried my hardest to never be a problem student. I kept my grades up, I was really quiet in class, and I made sure to get homework in on time. 
For some reason though, my 7th grade English teacher, absolutely despised me. 
At the time I had crippling social anxiety that I had to tell the teachers about. It was bad to the point where I would get physically sick in front of bug crowds. This teacher however, who I’ll call Mrs. G, completely disregarded that. 
We had a presentation coming up and I was hoping that like all my other teachers, she’s let me do it in private at lunch. 
Every other teacher I had had no issue with this and understood that it was completely reasonable.
Mrs. G said it was a “waste of her time and completely unnecessary”. And so next class period I had to present in front of everyone, which resulted in multiple stutters and eventually I passed out. 
She brought the issue up at conferences, telling my mom I “put on a show” for the class and caused an “unnecessary” distraction. When my mom brought up the legit issue I had because of past and current bullying she told her that I “was making stories up for attention, and that my class had been nothing but nice to me”. I remember seeing how red and angry my mom got, but she dropped it and we moved on.
That year I also took my first year of Spanish, and I remember coming to class really excited about a test I had gotten a perfect score on. I was telling my friend and Mrs. G overheard, and called me out in front of the class. She called me a “self-centered narcissist” (Which I find funny because those literally mean the EXACT same thing). I was so embarrassed. I had to excuse myself to go throw up because everyone ended up looking at me and it was because she didn’t know it isn’t OK to call out students like that. 
I brought it up to the counselors and they dropped it, never giving me a reason why or anything. 
At the time I was also trying to figure out who I was in terms of sexuality since it had been bugging me a lot. I figured I was bi and one of my friends made me a bracelet with a rainbow on it. After a class she stopped me and asked about it, and I was so giddy I completely ignored everything she had done and announced proudly that it was indeed a pride bracelet. Her response? “You’re just a kid going through a phase, that (bisexuality) isn’t even a real thing”
I was really upset about that, and it made it a lot harder for me to come out again when I realized later that I was a lesbian. So she messed that up too. 
The last incident is what I remember best. 
At the end of the year she did a thing where she told each individual student what she thought about them. In front of everyone.
I was first, since I was the front corner.
She said I was “manipulative and demanding, but I draw anime good”. 
I don’t even draw anime, so I was just angry to myself and then I was gone when the bell rang. 
So yeah, worst teacher ever.
I’m only a Sophomore though, so someone worse may come along.

(Word Count: 582)"
Teacher makes me cry and lies about it.,"English is my third language so I don't know if there will be any mistakes. I will let you know that I was a good student at all my classes like teachers favourite student. So this happened to me when I was at 6th grade in Syria and I had a geography class, my teacher finished teaching and went on her phone, (okay so we had this rule in school saying that nobody can use phones in  class and she was breaking it). So everyone was talking to each other and there were a boy who was teasing me so I was telling him to stop, and the next thing I heard was my teacher shouting at me saying:SHUT UP OP I HOPE YOU DIE. (She said it in Arabic just to me even though everybody was talking)everybody then went silent and looked at me, I started crying and she didn't even bother to say something to me. It was last class so everyone went home and I went home as well still crying and, told my mom so we got her number(because we were living in a small village everyone knew each other). My mom called her and the teacher LIED about it and said I was lying and she didn't do it , my mom told her that I don't lie(which is true) and then she said that she was tired and sick and taking medicine etc. My mom told her that it is not a reason. She didn't say it to me again but I don't love her as much as the other teachers."
You don’t have depression you’re just an attention seeker.,I used to have a teacher called mrs g who use to say that mental illness was a choice and didn’t believe I am clinically depressed (even had paperwork from my doctors) there use to be a kid in my class who would bully me constantly I use to tell my teacher but again she would say I’m an attention seeker and depression isn’t real one day he told me to kill myself in front of her and she said nothing I punched him and left the room she called my parents and told them this was completely random and she’d never been told about him bullying me they had a meeting my dad knew I was being bullied and knew what she had been saying to me. He went crazy at her and my parents pressed charges against the school she was promptly fired for negligence
