Titles,Text
Getting yelled at because of a timed quiz,"I remember being in grade school and we had timed math quizzes. They were made to be like a game where if you did one really well you move up from addition to subtraction and so on. Well I have always been bad at math and the quizzes being timed didn't help.
 So I was very behind in the game while all the other kids were way ahead of me. Did my teacher think ""hey maybe I should talk to this child's parents about getting her into some special math classes to help or something?"" Nope her solution was to pull me out of class and just yell at me in the hallway. She said something along the lines ""this is unacceptable. All the other kids are way ahead so be better."" And I cried my eyes out. I never told my parents cause I thought I was to blame. I'm now a 20 year old in college and that teacher is still teaching in my hometown."
Abusive 1st grade teacher,"When I was 6 years old I had a 1st grade teacher that was the worst she played favorites ignored students with learning issues (disability, language barriers, etc etc). She sent students to time out for even minor issues such as coming back eating lunch at home through wrong entrance. In fact she kept one my classmates in timeout for so long they peed themselves in front of the class because that was her favorite spot to put students in timeout."
Professor Told Me to Drop Out of My Major,"Here is some background. I'm a music education major and I play the oboe. Currently enrolled at a school in San Diego. This happened when I was at a city college. My band director made me feel like shit, but my orchestra director saved me.

I have always been insecure about my playing. I started playing oboe back in 2014, my junior year of as HS. Which is pretty late for someone to start on oboe. I was bullied quite a bit for it I  high school. When I got to college I was more accepted and quickly got better because my private teacher inspired me to do better. 

My band director (BD) was pretty chill, but I got vibes from him I didn't like. He was nice to me, but I noticed he had favorites. The few people I hung out with aren't on that list, so we were all insecure because of it. I would say I'm the better musician of the group, but they're also great musicians and we encourage each other. 

My fourth semester we were playing some more complicated music. One was El Comino Real, by Alfred Reed. There is a big oboe solo on it and I sounded good on it. The day of the concert I played 1 wrong note, but you couldn't tell. My teacher didn't think I was good enough, so the next 2 concerts we had he hired people to play my part. The 1st of those two concerts my teacher brought in a guy was amazing at oboe and had been playing for much longer than I have. It made me really insecure that he paid someone to play a part that HIS STUDENT is supposed to play. It was cool playing with the other guy, but I was nowhere as good as him and i compared myself a lot during that concert. The next concert he brought in another girl to play that part. He didn't tell me this until a week before the concert. BD allowed me to play the solo in class and had me thinking was going to get to play it. The day of the concert I meet the girl during our rehearsal. She was playing it wrong and messed it up during the concert. I wasn't mad at her at all. I was pissed and upset with BD. I was hurt that he had no faith in me. Everyone told me I should have played the solo and not hurt. You're supposed to show case the hard work of your students not the people you paid to play.  From that day on BD was dead to me and I was no longer inspired by him. 

My fifth semester rolls around and we got another oboist. He had been playing longer than me and he is older than me. He was good and we're both on the same level. I put more work into my playing and music than him, but for some reason BD only focused on him. 

Around this time I was hit with depression and anxiety. A lot of my confidence depleted and was non existent. I constantly made dark jokes about my playing. Then one day when I was supposed to perform for class I had a really bad break down the night before. I emailed BD and he said to go see him before class. That day I was mentally exhausted and felt sensitive still. I didn't want to do anything. I didn't want to be anywhere. I went to see BD and he asked what was going. I told him about the stress I've accumulated and about a broken heart. When I looked at his face he was so stern. He honestly looked like he didn't care about anything I said. The next thing he said to me broke me in to a million tiny pieces that would be hard to be put back together. 

BD: Sound like to me you don't have what it takes to be a music major.

As soon as he said that my eyes widened with sadness. I wanted to cry but I held it in. I didn't want to show anymore weakness.

BD: You should just quit and figure something else to do. If you can't handle your classes then quit. If it's too much for you then drop out. Clearly you don't have what it takes.

My heart sunk and felt like a nuclear bomb was dropped on it. I couldn't believe what just happened. I walked out of his office and closed the door. Tear began to slowly drop down my face. I walked out the building to leave. When I saw my two closes friends. I cried and let it all out. I tried to explain what had happened, but I kept crying and kept getting worse. They told me not to go home because it'll only show more weakness. 

After class the three of us went to my house. We sat in my living room and talked about everything. Talking to them made me realize that BD was wrong and I have the capabilities to become a music major.  

The following monday I talked to my orchestra director  about a solo I was playing in a concert and he said I sounded great. Something BD never told me. Of course he gave me some criticism, but he helped me spark up some confidence. When we had concerts for orchestra I got to stand up to receive recognition for the solos I played. It took 5 semesters  and I FINALLY got to stand up and be recognized and applauded for my playing. Again something BD never did. 

 That semester he inspired me to be the best oboist I can be. I told him about my problems with some classes and he gave me advice to help me pass those classes. My sixth semester I was getting acceptance letters to schools I've wanted to go to. I am currently going to my dream school on a scholarship and have proven to BD that music is my goal and I am right where I belong."
Funny,
Principal caught cheating on camera at school raffle,
"Same exercises, different right answers",
"Mmmm so it's not 298, it's 298",
Teacher is rehired after being fired years prior.,"The choir middle/high school teacher at my school was fired years ago and was just recently rehired after the previous choir teacher quit because of the school’s lack of accommodation toward’s her schedule. In mine and, to my knowledge, many other’s opinions she shouldn’t have been rehired in the first place if she was FIRED; which I assume means she did something bad or was simply bad at teaching. My assumption now, after observations, is because she was a horrid teacher. I don’t personally take her class as I don’t enjoy choir, but a few of my friends do and they constantly tell me that they skip her class until they can officially dropout of it. Other classmates, and my friends, have also said very openly that she barely allows them to sing at all and that she refuses to take any constructive criticism as she hasn’t taught older children for a LONG time.

I can testify that the “no singing” part is true as our recent Veteran’s Day choir concert the only person I could her was the teacher. You could tell the children were singing, however, we’re very off key and didn’t quite know all the lyrics. The teacher is still in her first year being with us, but many people have advised the board NOT to give her a tenure as many people were already dropping out of her class as soon as they can.

I do believe she is trying her hardest to try and fit in and do her best as a new-ish high school and middle school teacher, so I hope she’s able find her feet here and become a great teacher that many students will be able to express themselves and their group through their songs."
Accelerated ELA 10 teacher has blatant favorites and a blatant undesirable no. 1. You know who the undesirable is.,"So. For context, I have difficulty in school. My academic potential is pretty good, and I pick up on new concepts fast. But I still manage to end up flailing my arms around trying to get to a C before the marking period ends. So, we tried to have accommodations set up to help me (my state has a law that if a student is shown to be capable but is not performing as expected, they can receive accommodations to get them to that potential). All of my teachers were sent questionnaires to ask what they thought of me. My AP US History teacher sends, I kid you not, answers that could win an award. I mean, each paragraph had a three-part thesis with supporting evidence to boot.

But my ELA teacher? here's what her paper looked like. And these papers are issued by the state, by the way.

* What is this students general behavior like?

>Fine

* Does the student seem depressed or otherwise ill?

>No

* Any other issues you'd like to address?

>Hygiene issues

I take several issues with these answers. First, she didn't even seem to care. Her answers felt more like evasion rather than response.

Second, Hygiene issues? I took gym as a seventh hour just so that the classes i go to aren't smelling like shit. I shower for a half hour every day! I don't have hygiene issues!

Third, she's an English teacher. And she didn't even answer in complete sentences.

I asked her about all of this on Tuesday. She says that my hygiene issues are because i'm picking my nose. I'm scratching the outside of my nose! My skin gets dry as all hell during the winter, so i'm going to be scratching my nose!

This is where the shit hits the fan.

She goes on the mother of all power trips. 

* She says that she's the teacher and i'm the student, and it's not my job to heckle her on what she does (there isn't anything there to be heckled)
* She says that as a teacher, she has to do a lot of paperwork every day. This is not an acceptable excuse. I see her looking at goddamn Athleta or Under Armor websites EVERY FUCKING DAY
* She has time to go into the school's weight room for an HOUR every day after school. I know this because I see her leaving the weight room as I'm going back to the locker rooms after my 7th hour.
* She pulls her age card. ""I'm a teacher, you're a student. I'm older than you. we can argue about this once you have a college degree."" I hope she dies before I get my college degree.

I really don't like wishing death on people, but this teacher is just so infuriating to deal with. She's the only Acc ELA 10 teacher in the school, meaning that I have to deal with her next semester too. And I feel like she does this because she knows she intimidates us. She is extremely muscular, and she knows damn well that she can beat the shit out of all of us with one hand behind her back if she wanted to.

I'm getting anxiety because of her."
Terrible teachers,"I’m a long time lurker and this is my first post, and I’m on mobile, so... ya.

I go to a charter school that’s really small, so there’s not many problems, but there’s three teachers I have a beef with. One of them technically isn’t a teacher, but she’s close enough. Also, I’d consider myself the class clown, and I’m pretty confident.

Story one: 
Because I go to a charter school I take Latin. Useless, right?! It’s definitely going to be usable in real life.*heavy sarcasm intended* 
So, it was after math, and me and my friend headed over to the Latin room. We went in. Keep in mind, we are still on break technically, but we just got in early. The teacher, who we’ll name, mrs. c, was in the room. I was  joking around with my friend, and I said...

Me: don’t you sass me like that! *jokingly*

Her: Excuse meee!

Me: what?

Her: don’t eeeuuuuuseaahhhh that language in my class

Me: what language?

Her: you know what language

Me:ok.

At this point, I was pretty confused, and I was talking to my friends about it. Here comes... the climax. I scooted out of my desk on my chair, when my knee scraped HARD on a bolt on the underside of the desk, and I expressed the pain with a very audible “OW!” And this triggers a rant from my teacher

I wasn’t really listening, but I mostly heard
“Stop stealing attention from me” and “you’re not really hurt! Stop faking for attention,” meanwhile I’m bleeding pretty bad and in pain. 

Story 2: 

Here’s the main event. This idiot teacher, who we’ll call mrs. Ann, is the PE teacher who also watches everyone at break and lunch. There’s tons of annoying things she did (or didn’t do), like the kids a grade younger than me threw a basketball AT MY EYE, and she saw, and did nothing. But when I threw a dodgeball at them, she made me sit out at the tables for 30 minutes. But the main story is this:

This happened at lunch. It was fun and all,  but when lunch ended, she blew the whistle right in my face. My ears were ringing and my head hurt. And then, as if to rub it in, she blew it again in my face, and told me to clean up my trash, and pointed to a table about 10 yards away(I say yards because I play football and I’m used to saying yards) from where I sat. I had math after, which was horrible, because both my ears were still ringing, and so I couldn’t hear anything. 

So yeah, that’s it. And a fun fact, mrs.ann when I was in 6th grade mocked my friend. P

Please tell me if this doesn’t belong in this sub. Also I’m going to post this on the bad teachers sub, but I can’t remember the name of it. Could you tell me in the comments?"
Drama teacher constantly picked her favorites when it came to casting.,"So here's a story that I really shouldn't be mad about still, considering this all happened in middle school. (yikes, I'm in my junior year of high school...) In 6th grade, I was so excited that my new school offered a theater class. I had always been into performing in front of people since I was little. I stepped into class the very first day, and I loved it! The teacher, who we will call Ms. Jones, (not her real name, I'm terrified of confrontation so we don't have to worry about her finding out :/ ) was so nice, and considerate to those who had stage fright. A month or two later, she announced that she was putting on a musical, and I was absolutely ecstatic. I went straight home and started practicing my audition.

After my audition, Ms. Jones said I did really well, and she said she was considering me for one of the leads. I was asked to show up to call-backs the next day. I practiced and practiced my solo that night. I wanted that role so bad.

When the cast list came out I was just about the first person there. I scanned down all of the names and I saw that I not only didn't get the role that I wanted, I didn't get into the play at all. Not even the ensemble. (the people that are just in the background, filling the stage.) My little 11 year old heart dropped. I wished she hadn't gotten my hopes up.

The spring musical rolled around near the end of school, and I tried again. She told me the same thing that she did during my last audition. I went to call-backs again. Same thing happened again. But I was persistent. I thought that if I kept trying out then she would eventually pick me for something. Sometime in 7th grade, I began to realize that the same people were being casted for the leads every single year. I even tried to make friends with them, to see if she would consider me then. Of course, she didn't.

I wasn't the only kid being picked on, I met this other girl (we will call her Ruby) who was going through the same thing. We shared stories and I decided to talk to Ms. Jones and find out what went wrong with all of my auditions. She had nothing to say really, just that ""she changed her mind and thought the other person would be better."" Real encouraging, right? Ms. Jones could have at least told me what I could be improving. But I guess not. I happened to talk to my mother about the situation and she insisted to go talk to Ms. Jones. I let her. All of a sudden, the next play, I was put in the ensemble. Coincidence? I think not. My mom is a sweetheart with the softest soul, she would never threaten Ms. Jones or anything. I just don't see why she decided to let me participate, after all those times i had been turned down. 

Ever since then I've doubted myself, and I've been too scared to try out for anything to this day. My current chorus teacher always asks me if I want to do one of the solos, and I've turned her down every single time. I guess I just don't want to be disappointed again. Honestly, what Ms. Jones put me and so many other kids through was in no way fair. It's a middle school play. It's nowhere close to Broadway, honey. My advice to her is to let some other kids have a freakin' chance. Don't give them hope just to rip it from them a week later."
"6th grade teacher says ""You either keep on writing or give up""","Ok this is a short story to tell irl but I will try and extend the story just a smidgen for no reason.


Cast: Op= Me C= Classmate BT= Bad teacher


Little bit of a backstory; So in 6th grade BT assigned a 5 paragraph essay for an interview of what your occupation you chose will be when you grow up, I chose a lawyer. Writing the essay was classwork but incomplete stuff had to be finished on the weekend. The problem was that I forgot to do the interview questions so it was incomplete so did C and a few other students. BT was going on about and asking classmates 
""Hey blank how do you feel that you don't get to start the essay because your peers didn't finish their work"" 
Other Classmate replied: ""I don't care"" 
BT went on saying that ""Well maybe you don't care but other kids feel frustrated""
Istg this lady had the audacity to talk crap about her ""failing students"" I'm front of their faces. I was having a mental breakdown because of the smiley face incomplete stamp and the fact I was one of the students who didn't finish the interview questions and i won't be able to write a like 5 paragraphs. Ok so I was procrastinating because I was the 11 year old that doesn't want to spend the weekend doing ""homework"" for the interview questions or the essay. I did finish the essay early but C who sits next to me wanted to be an artist and he didn't get enough info to even write like idk 2 paragraphs

C asks for some help around the table and I as a little bit of an artist myself, well more of a colouring and sketching type more than the painting type, gave a little intel but it kinda wasn't enough so he went to BT. Conversation went like this;

C: *raises hand* ""Hey BT?""

BT: ""Yes C?""

C: ""I don't have enough information for my essay and I can't extend it""

BT: ""Well either keep writing or give up""


Yes she said it she told an 11 year old to either keep trying or give up. Like c'mon man he's just asking for advice. C starts crying and all I could do was pat him on the back as I am not good with interactions with emotional peers so all I do is just back pats and I say ""it's ok"" I couldn't hug him because in 6th grade

You hug a person opposite or not opposite of your gender (mostly if you're a girl and you hug a guy) and some popular ass girl sees it, now you have a boyfriend/girlfriend because you can't convince anyone it isn't unless you have a reason like they are siblings or smth like that. Also I had a little crush on him and I didn't want anyone to find out. (._.) Now the internet knows


Ok back to the story


BT goes and helps C as he's crying and she says ""it was a rhetorical question"" and he some how gets the little information into an essay.



Lesson learned for people out there

Teachers don't be a hypocrite

Students finish your homework.




Ok I'm just gonna go ahead and say 
""SHE HAD POSITIVE POSTERS ALL OVER THE DAMN ROOM""


The end, have a nice day."
i saw this on my test,
"Art teacher tells me to go back a grade, I progress to state level in art comp","To start this off I have to explain how art levels work in my school system. Art 1 is the first year of art credit in high school, after this you can progress to advanced art classes like painting, drawing, printmaking, etc...

Well my middle school gave the option to 8th graders interested in art to take Art 1 for high school credit. I've always loved art and have been told I have a talent for it, so naturally I took that class, which meant I could take advanced art classes freshman year of hs, while most students had to take art 1 freshman year. Not knowing any better, I chose to take drawing, because at the time that's the kind of art I was into. For this story we will refer to the teacher as bob. 

Bob was an older man whose classroom had entirely while, barren walls, which is odd for an art class. He started the first day with a lecture that lasted the class period (1hr and 30min), where at one point he explained how he invented a type of graphite shading (which turned out to be a really basic and common type of shading). He then proceeded to give us assignments which were basically ""copy this stock photo I printed perfectly in pencil"". Our first project was colored pencil  only, which happens to be the medium I dislike most. I was really into ink, and the different shadings that could be done with it, but nope, colored pencil only. On multiple occasions I've seen him actually erase and re-draw parts of students work when they brought it up to him for advice (which if you're an artist know is basically a crime), and at one point referred to a female classmate as ""babygirl"". He never gave instruction in class and literally sat at his desk the whole time without saying a word while we worked in silence. The few times I brought my project up to him for some constructive criticism/advice for how to improve, Bob would somehow turn it into a rant about how ""see? this is why little inexperienced kids shouldn't get into drawing. it's very advanced and someone like you should be in art 1"". 

Eventually through a lucky sequence of events I was able to make a piece of art in a medium I enjoyed and had it entered into a pretty big art competition in my state. I didn't expect much out of it but it actually progressed to state level and got perfect marks on both state and regional level. 

His behavior towards me at the state competition basically solidified what an ass Bob was for me. Students were gathering after the art show, collecting their art, medals and judge sheets, where they could read what was said about their piece. This was very exciting for everyone involved as not many get to go to state level. People were taking pictures with their medals, art pieces, etc. Except mine was no where to be found. When I asked Bob where my piece and judge sheet were he disinterestedly said they were in his truck, he would give them to me at school on monday. After asking again if I could have them now he finally went to retrieve them from his truck, making a whole show about how inconvenient it was for him and how entitled I was being. Yeah? Entitled to the same treatment as the other kids? This was a rare thing for me to get to do, just like everyone else. It was an important moment for me and my confidence as an artist and I just find it gross that his spite and selfishness tried to ruin it for me."
